title,description
The Shawshank Redemption,"Two imprisoned men bond over a number of years, finding solace and eventual redemption through acts of common decency."
The Godfather,"The aging patriarch of an organized crime dynasty transfers control of his clandestine empire to his reluctant son."
The Dark Knight,"When the menace known as the Joker emerges from his mysterious past, he wreaks havoc and chaos on the people of Gotham."
Pulp Fiction,"The lives of two mob hitmen, a boxer, a gangster and his wife, and a pair of diner bandits intertwine in four tales of violence and redemption."
Forrest Gump,"The presidencies of Kennedy and Johnson, the Vietnam War, the Watergate scandal and other historical events unfold from the perspective of an Alabama man with an IQ of 75."
Inception,"A thief who steals corporate secrets through the use of dream-sharing technology is given the inverse task of planting an idea into the mind of a C.E.O."